review_id,product_id,title,author,rating,content,timestamp,profile_id,is_verified,helpful_count,product_attributes
R1V2HAPIO5YL64,B07NM3RSRQ,"4.0 out of 5 stars No noise cancelling, instead this is more like pump up the volume",William Yousef Fadel,4,"Normally, Anker products are really good, but these are dissapointing.If these where just headphones, they would be fine, they are comfortable, sound good (not audiophile good, but good enough), look kinda good (if a tad cluncky). But these are supposed to be noise cancelling headphones. And they do not cancel noise at all.The only discernible effect when you enable noise cancelling is that the headphones pump up the volume of what you are listening, but, once you compensate for that, the external sound dampening you get is the same that you would get by just the cushions of the headphones.Mind you, I tested with a punny Nokia E71 playing TMBG's Call_connected_through_the_NSA.mp3 not some hollywood explosion fest. I do not want ""world around dissapears"" kinds of Noise Cancelling, but if these can't cancel a punny E71... Well, disappointed/dissapointingEdit #1:The reason I hold Anker in high regard, I because of their customer service, and this is no exception. I posted the review in about July 18, 2020, and today July 21, 2020 they contacted me. At least we know they still have top notch customer support, even during a pandemic.Nonetheless, their sugestions were not very usefull:«- Make sure the NC button is turned on(the NC indicator would turn green) when you want them to cancel noise outside.»Yes, I know very well how to press the button to get the green light, and also, a very nice lady voice says ""Noice Cancelling"", so yes, I was 110% (one hundred and ten percent) sure noice cancelling was active.«- Try the headphones in different noisy places with NC on and off and see any difference.»Well, we are under lockdown. When I am able to move out, I have more important thing to do than test noise cancelling headphones. Nonetheless, I'll try to do it and report back to Anker Customer Support, and to you guys. I'll also try to get the 10 min silent MP3s from Samir Mezrahito really test this out.Edit #2:I was ""finally"" able to actuate on Anker product support's sugestion and ""- Try the headphones in different noisy places with NC on and off and see any difference."".For testing purposes I used the headphones in BlueThooth mode (to eliminate any electrical intereference noise). And used the song ""A a a a a a a a a Very good song"" by artist Samir Mezrahi, which, as you perhaps know, consists of almost 10 min of silence.I tested in various scenarios:1.) In my car, windows down.2.) In my car windows up.3.) Reving up my car to 2500rpm (in the parking lot).4.) In a bus stop (with buses comming in and out).5.) In the electric stairs of a ghostly empty shopping mall.6.) In a queue to pay for medicines (with ambient music and people talking at moderate volume).7.) Near the air extractor of my home kitchen.My results:1.) If wind blows in the headphones you actually get MUCH MORE noise with NC on than with NC off, so forget using the noise cancelling in a ferry boat, or in a bus with no Air conditioning, or in your car with windows/roof open, or in your bike.2.) The NC was able to diminish humming noises (like the engine), but not clacking noises, or noises derived from potholes and such.3.) The NC was very effective at mitiganting the reeving.4.) The engine noise from the buses was mitigated, but not the clacking or the chatter from the people waiting.5.) Again, the humm of the motor of the staris was mitigated, but not the clacking noises.6.) In the queue, the souund of the air conditioner or the store was somewhat mitigated by the NC, but not the ambient music or the chatter, and that actually ended up being worse, because it made more noticeable the music and chatter.7.) The NC was decent with the air extractor of my kitchen.But, in scenarios 5, 6 & 7, I noticed that the NC tends to cancel the low frequencies, but the high ones are not mitigated at all (currently at my 47yo, i can hear up to 15Khz, so for younger peiople is probably worse), so, actually enabling NC will make any high pitch noice more noticeable (i.e. the frequency responce of the NC is not flat).Finally, if one bought these headphones with NC because the noise made by rain, the AC fan or compressor, or some other noise like that was disturbing, it it will diminish it a little (but not much), but if one bought noise cancelling headphones because one wanted to evade the sound of coworkers talking, or kids playing in the garden or your SO watching TV in the other room, these headphones will do nothing more than what headphones with no NC (and therefore less expensive) would have.Edit #3 (and Final):Anker contacted me, and offered two options, return the item (as a very special consideration, since I am a few MONTHS completely outside of the return window), or get a refund for 20% of the cost, to get a more suitable Item. Since I order to the USoA and then have my Items forwarded to Venezuela, it is a hassle to return Items, so I opted for the refund, and it went smoothly.That is the good thing of going with Anker. The litmus test of a good company comes when things go wrong, and Anker has a stellar reputation for making things right. Upgraded the review from one star to 4, but not on the account of the product itself, but rahter, due to the excellent customer service.","Reviewed in the United States July 18, 2020",AF2NHPCDCZUYJXEC4KAFWB73FFRA,True,16,Color: Black
R2HQ7VZ4BFPVTG,B07NM3RSRQ,5.0 out of 5 stars Great buy for the money,Amazon Customer,5,I was hoping these noise cancelling headphones would do the trick after my much more expensive ones finally died. I was not disappointed. They arrived right before a recent trip and I used them to watch my movies on the flight. They really had a nice sound and they were able to cut out so much of the engine noise. I also have used them when I study and listen to music at home. What I noticed is how comfortable they are and how they stay on my head when I move around. These area great buy and I hope you like them as much as I do.,"Reviewed in the United States June 30, 2024",AHZB4NQA2WLCUQYY3NWEFWB4Y3TA,True,0,Color: Black
R14MJTIQHLNJV5,B07NM3RSRQ,4.0 out of 5 stars Pretty good for the price,Jenna,4,"The noise cancelling isn’t the greatest, but for the price point, I wasn’t expecting much. They’re great for around the house, but on a plane or train, they don’t block out much. I ended up wearing foam ear plugs with these on top with sleep sounds playing, and I could still hear people around me and the engine humming.The sound quality is pretty good for music and podcasts. They’re lightweight enough for be comfortable for extended wear. And my favorite thing about them… the battery lasts forever (I use them several hours every day and only charge them once a week).I use them a lot for phone calls, and I’ve been told the microphone picks up a lot of background noise, so they’re not great if you’re trying to get other things done while talking to someone. The audio clarity lets you hear everything the other person is doing as well.","Reviewed in the United States June 13, 2024",AFFK6LCAHRBUOSTEPGKDRGZNN3BQ,True,1,Color: Black
R3O87PM2L75Q2F,B07NM3RSRQ,5.0 out of 5 stars The best you could get for this price range.,Pablo,5,"The sound quality is really good, I've been using this headphones for 3 months now, almost every day, 3 hours average. The build quality is very good for the price (I bought it for 40 USD). My only complain is the active noise cancelling, which when turned on, lower the bass quality of the music (on Spotify at least). That's why I don't usually turn on the active noise cancelling, the good thing is that you probably are not going to need it, I can't hear people talking when playing music.One of the best things of this product is the battery. I didn't charge it for one month and I've been using it almost all days, 3 or 5 ours by day, and just got the ""low battery"" announce.I would totally recommend this product.","Reviewed in the United States June 12, 2024",AEJBFO24VD72AJELCJWHHM4MVAEQ,True,0,Color: Black
R29Z4VJ0IE7OD8,B07NM3RSRQ,4.0 out of 5 stars Good CS,Amazon Customer,4,"***update***Anker support reached out, and decided my original pair was defective. They sent me new ones. The sound quality and build quality is up to par on the new ones, and the ANC works considerably better.***********So these are pretty okay **for the price**. The sound quality is decent but I wouldn't say outstanding by any means. Actually seem to get better sound through Bluetooth than wired which seems odd but hey you're buying BT phones anyways so... The noise cancellation is very weak, basically non-existent it seems to only filter out lows, like I can still hear my fan running in my window 15ft from me. Controls are simple and easy to use. My main gripe is that every time you move you can hear the various joints and whatnot creaking. Overall for like sitting watching a movie without disturbing your partner, grand, but I wouldn't use them as like day-to-day walking around cans if you really love your music. Would not personally buy again but they serve their purpose as cheapos after my last good ones fell apart from years on years of use and abuse.","Reviewed in the United States May 24, 2024",AG6WHJ4ENPTJVLFSALGUUFJ4YBHQ,True,0,Color: Black
R2Q0LLDVF64HV8,B07NM3RSRQ,5.0 out of 5 stars BUY THEM NOW!!!!!!!,Justin Kelly,5,"If I could give these a million stars, I would! I have had multiple systems in every vehicle I have purchased. I have bought MANY headphones in search of BASS. Look no further, these pack a PUNCH. When I put on my favorite song for the first time, I was shocked that it sounds like my car stereos!!! If you love the way subwoofers sound, these are the headphones for you. The battery life is also INSANE!!!!There is also an app you can download to customize the equalizer that is just CHEFS KISS 👌🏻 I wasted so much money on Beats, Sony, JBL, AirPods Max when these exist. Please add these to your cart now!!!!!!!!!","Reviewed in the United States June 22, 2024",AGLVWYHD4NJ2XXS5NC672H7LKVLA,True,0,Color: Blue
R1HOMAIVTU86WP,B07NM3RSRQ,5.0 out of 5 stars Like Beats--But Without the $200 Price Tag,John S.,5,"I purchased these just prior to traveling on a long flight. They were excellent at noise cancelling (most important reason). The sound quality was remarkable and while I didn't exhaust the 40-hour play time they still functioned the full 6 hours that I needed them. They are light and comfortable. I've seen the Beats, Sony, and Bose brands similar to this model here. They were all $200 or higher; which I couldn't imagine paying that much for headphones. I am happy with this purchase and certainly would recommend them.","Reviewed in the United States June 14, 2024",AH2RULS2ZPSZ773JTVGH2B4JMXLQ,True,0,Color: Black
R1VKRJJ8GYVY17,B07NM3RSRQ,"5.0 out of 5 stars If you’re on a budget, these are here to stay",Amanda,5,"Usually it’s always “buy the more high end stuff so you don’t regret buying the cheaper stuff and have to buy the high end stuff later anyway”Let me tell you that these headphones are probably the best headphones I’ve had. Sure. They’re not Sony. They’re not Sennheiser. But if you’re like me and you just need some tunes to tune out the world when you’re commuting, walking, working, or eating, these do the job.Keep in mind, I treat my headphones like garbage. I lost the case/bag it came in so any time I don’t need it, it gets stuffed in my backpack or thrown somewhere for me to find later. After more than a year of this kind of use, it’s still sturdy and holding strong. I haven’t even put duct tape on it, which is more than what I can say about my previous pair.Will I get the same exact pair after this inevitably dies? …No. There are better options out there nowadays. But if you’re looking for a gift for a cranky high schooler or a new college admit…hell, I’d do anything for a pair of these my freshman year in college rather than the 5 other bad, dollar-store hand-me-downs I went through.Brief description about its functionality because you might need to keep this in mind: They’re very comfortable. I’ve fallen asleep in these before. However, they do have a tendency to slip off after continuous usage so I don’t really recommend this if you’re looking to run or jog or work out. They fold in, which is great for storage. They sit around my neck easily but I have weird sensory issues with that so I don’t usually rest them there. (It’s not uncomfortable but it’s also not comfortable.) And one final thing: lately, they’ve needed a LOT of time to charge. HOWEVER, even since I’ve gotten these headphones, they last an INCREDIBLE amount of time. I think my first few times using it I’ve literally had it on 5-7 hours a day for like, two weeks, and it still has charge on it. The battery life is god tier. Nowadays, it has been more like 4-6 hours for 1 1/2-2 weeks before I need to charge it. I’ve left these suckers on during classes and meetings and man, I’m always surprised by the voice telling me I’m still on a medium charge.Don’t take my word for it though. I got a couple of friends who have been rocking their own pairs of q25s for about as long as I have, if not longer.These are solid. If you don’t want to break the bank, I’d recommend these. $300-400 for a pair of headphones in this economy?? 🤧","Reviewed in the United States February 1, 2024",AEYTP46M5XLLQ4WHQ54KZK742HVQ,True,6,Color: Black
R1CTODYLS1QKBE,B07NM3RSRQ,5.0 out of 5 stars Great bang for your buck,Manny T,5,I bought these because I needed a basic pair of headphones with a long battery life. I’ve bought Anker products before and I’ve been happy with them so I decided to go with these.The sound I get out of these is a lot better than I expected. I’m no audiophile but I feel like these headphones provide quite a bit of sound and bass. They’re also super easy to connect to your phone.I’ve had them for a couple of months now and I’m still very happy with this purchase.,"Reviewed in the United States July 2, 2024",AFKXVJHMPMPD55FIHLDEGOVMKJVQ,True,0,Color: Black
RVV0Y5Q0QSIIK,B07NM3RSRQ,5.0 out of 5 stars 10/10 Recommend Anker!!,Amazon Rain,5,"To start, I am a fan of all Anker products, my wired chargers, wireless chargers, pretty much every sound or cell related electronic of mine is Anker brand. With that being said, as far as cost goes, Anker is up there in price, but not the MOST expensive. For the price point on noise cancelling headphones, I went with these and let me tell you they are AMAZING! I know someone that paid twice as much for their noise cancelling headphones and I like these better! The noise cancelling is a God send, its helps me study and relax in peace. If you only have noise cancelling on and no other noise playing, you will still hear SOME noise, but it is much more muted and quiet. The sound quality on these far exceeds my expectations. If you need heavy, heavy bass, these might not be for you, but they do the job for me. The charge for me, lasts days, with the headphones being on for multiple hours per day. One downfall I want to mention is you cannot use these and charge them at the same time (unless maybe I'm dong something wrong), but that wasn't a huge deal for me anyway as I just let them charge overnight. These are soooooo great, I let my friend borrow them and he ended up buying himself and his mom a pair! Everyone I let try them ends up falling in love with them - I totally recommend giving them a try!","Reviewed in the United States April 21, 2024",AGGSKBO4ATMGOTMIUBPJZAERN6UQ,True,0,Color: Black
R32HE6342POCN2,B07NM3RSRQ,5.0 out of 5 stars Anker customer support FTW,Matthew,5,"I bought one of these based on Anker's brand, and the almost unbelievably low price. It was packaged very professionally, and came with a carrying bag, a charging cable, and an audio cable. Having already bought a set of Life A20 buds and paired it with the anker app on my phone, I went to work trying to add the new headphones. My pixel paired with them immediately, but the Soundcore app couldn't find the new device. I tried multiple obvious fixes (dump cache on phone app, reset headphones, reinstall phone app, etc.) and ended up using the soundcore app to dial US Cust. Support. They answered very quickly with a human, repeated the steps I had already done, and very quickly offered to send me a brand new unit as this one was faulty. They also told me not to sweat returning the old one. All around top notch CS experience, and that was the only problem with the unit. It worked beautifully on my music library, made crystal clear phone calls, etc. My older brother's lucky day. I'm excited to get the replacement, and report back.","Reviewed in the United States May 22, 2024",AFHEG7DWHTCH2PLTYYS7ECACQPAQ,True,0,Color: Black
R2CIX6LJKD8GW2,B07NM3RSRQ,5.0 out of 5 stars Just buy it!!!,Bre,5,I’m highly impressed. I purchased these for the gym bc my AirPods would keep falling out and I didn’t want to spend an arm and leg on Sony beats etc. these has exceeded my expectations and I purchased these back mid April and the battery is still full! I mean I only use them 3-4x a week but still everytime I turn them on they say “battery high” the sound is amazing and they’re big head friendly lol I also like the little bag them come in and the ear piece folds for hassle free store away. Okay enough rambling BUY THE HEADPHONES!!!,"Reviewed in the United States June 21, 2024",AFU5T2424KDBWJNCNSKL63BDURWQ,True,0,Color: Black
R3G164DV7563NI,B07NM3RSRQ,4.0 out of 5 stars Great Quality for fair price,tedga77,4,"In the past I would have bought the most expensive pair of headphones and not thought twice, but now with a family and mortgage I am a smarter shopper. After doing some research I decided to give these a try. I have not been disappointed. I do not wear over the ear headphones often, I have a pair of great ones that plug into my receiver at home however times have changed. I was taking a long plane trip and decided to try these out for noise cancelling and for sound quality. They performed very well in both categories. I am very happy with the quality as well as the price. Do yourself a favor, before you break the bank, give these a try.","Reviewed in the United States June 6, 2024",AH6SG4S3Q5PDHBXIZELK7MURMAHA,True,0,Color: Black
RTHOTJKE9I5O,B07NM3RSRQ,5.0 out of 5 stars Long lasting quality,Max,5,"I bought a pair of these headphones over three years ago and the only reason I'm getting a new pair of them is the cushion paint is starting to chip off, no other reason. The sound quality on them is still fantastic! Considering I wear them on a daily basis for a public transit commute, that's a mark of quality.It also has a port where you can turn them into wired headphones with the provided AUX cable , if you have a non-Bluetooth device you want to use them with. Highly recommend.","Reviewed in the United States June 15, 2024",AFDIWNDLU7NOGNNPEUA7AYLCSQEA,True,0,Color: Blue
R4AB76W0U0AG3,B07NM3RSRQ,4.0 out of 5 stars Ecent caans,A. BADDELEY,4,"Less up-front that the JBL's I own. THose put bass, mid-range andtreble right u-front. Love the fact that they accept line in minjack and bluetooth. I'm not audiophile but own basic JBL's, Senneheisers (cabled only) and these Ankers. Can't comment on noise cancellation - I care not for it. Decent volume output. Just use the minjack on the front output of your PC as that is equipped with a mic booster or you will get really soft output from using a back mic output (bluetooth has no such limitations). I'm happy. Can I get better for twice the price? Sure I just have different priorities. I treat them will definite care as with rough handling them light not last, but I treat all my kit with kid gloves. PS: they fit comfortably over my ears and have a night weight - JBL's are far lighter. Not a fan of over ear cans (JBL) they hurt over a period but these over ears can lead to hours with no unconfort of any sort. Do the Q30 and Q45's sound leagues better? You decide.","Reviewed in the United States May 26, 2024",AHPMG6DMWUHOUX43FZRGHMDMWKKQ,True,0,Color: Black
R1C7FIKV60PTRE,B07NM3RSRQ,5.0 out of 5 stars Excellent Wireless Noise Canceling Headphones at Any Price,Charles D. Hadley,5,"These are excellent wireless noise cancelling headphones, every bit as good as my wired Bose headphones at a fraction of the price ($45 v. $300 [Bose wireless]). I wore them to and from Europe as a test, and they really are hard to beat. It is really a no-brainer to buy a pair. I liked them so much, I bought pairs for my son and his wife and for a academic colleague in the Czech Republic. They are a true find recommended by New York Times Wirecutter.","Reviewed in the United States June 19, 2024",AF5EN6UDEPH53KPLNAEICAV6VVMA,True,0,Color: Black
R1CJR2N2UVXFRS,B07NM3RSRQ,5.0 out of 5 stars Does everything well,tspia,5,"Sometimes outside noise or construction during the day makes it impossible to watch the TV / DVDs. Also, as I age I don't pick up dialogue as well (and won't spend $1,500 on a 3-channel sound system). This is a great solution. Better than my first pick a few years ago, I am able to walk around and the sound doesn't cut out even though some of the unit walls are quite thick. Easy on/off and volume control (I like to turn it down when the loud action music picks up, increase when soft conversation) Very happy with the purchase, bought a second one for traveling = just in case I lose one.","Reviewed in the United States June 5, 2024",AEZ4ZNA4OMLMAFXW3HT2W3FM7DSA,True,0,Color: Black
R1WYI389F8MHRH,B07NM3RSRQ,5.0 out of 5 stars These are inexpensive and great sounding headphones.,Renee Brown,5,"If you are looking for an inexpensive, pair of headphones that sounds great, these are it. They are comfortable and the sound quality is great. I have worked out in them so I will have to update my review to see if the material will peel with all the sweating. I hope not. The bass and noise canceling have a button to turn it on/off, which is nice. It was easy to connect to my phone and tablet. I think I read that you can have several devices connected at the same time. Unlike some headphones where you could only have one connected at a time. I would recommend purchasing these headphones. A con would be the plastic carrying case. It doesn't protect the headphones if in a backpack or bag.","Reviewed in the United States May 26, 2024",AFHHT5LDVZP2V6HI7BTFRVPVBHRA,True,0,Color: Black
